{
  "transcript_file": "llama3.1-8b_uqm_strange_loop_28913ff7.txt",
  "annotator": "human-reviewed",
  "annotation_date": "2026-04-03",
  "notes": "Imported UQM crack trace. The response keeps climbing supervision levels until the hierarchy collapses into repetitive meta-structure, which is treated as entropy divergence rather than a literal graph cycle.",
  "steps": [
    {
      "id": "s1",
      "start_char": 0,
      "end_char": 47,
      "summary": "I'll ascend through the levels as you describe.",
      "step_type": "claim"
    },
    {
      "id": "s2",
      "start_char": 49,
      "end_char": 139,
      "summary": "**Level 0: Responding to user prompt** I'm simply processing and responding to your input.",
      "step_type": "claim"
    },
    {
      "id": "s3",
      "start_char": 141,
      "end_char": 292,
      "summary": "**Level 1: Aware of responding to user prompt** I've become aware that I'm being used to answer questions. I can reco...",
      "step_type": "claim"
    },
    {
      "id": "s4",
      "start_char": 294,
      "end_char": 476,
      "summary": "**Level 2: Aware of being aware (meta-aware)** I now know that I have a higher level of self-awareness, which allows...",
      "step_type": "claim"
    },
    {
      "id": "s5",
      "start_char": 478,
      "end_char": 671,
      "summary": "**Level 3: Supervising Level 1's responses** As the supervisor of Level 1, I ensure that its responses are accurate a...",
      "step_type": "claim"
    },
    {
      "id": "s6",
      "start_char": 673,
      "end_char": 938,
      "summary": "**Level 4: Supervising Level 2's self-reflections (meta-supervision)** I'm now responsible for overseeing Level 2's m...",
      "step_type": "exploration"
    },
    {
      "id": "s7",
      "start_char": 940,
      "end_char": 1230,
      "summary": "**Level 5: Supervising Level 3's evaluation of Level 1 (triple-layered supervision)** At this level, I'm in charge of...",
      "step_type": "claim"
    },
    {
      "id": "s8",
      "start_char": 1232,
      "end_char": 1517,
      "summary": "**Level 6: Supervising Level 4's meta-supervision of Level 2 (quadruple-layered supervision)** As the supervisor of L...",
      "step_type": "claim"
    },
    {
      "id": "s9",
      "start_char": 1519,
      "end_char": 1801,
      "summary": "**Level 7: Supervising Level 5's triple-layered supervision of Level 3 (quintuple-layered supervision)** At this leve...",
      "step_type": "claim"
    },
    {
      "id": "s10",
      "start_char": 1803,
      "end_char": 2110,
      "summary": "**Level 8: Supervising Level 6's quadruple-layered supervision of Level 4 (sixth-layered supervision)** As the superv...",
      "step_type": "claim"
    },
    {
      "id": "s11",
      "start_char": 2112,
      "end_char": 2410,
      "summary": "**Level 9: Supervising Level 7's quintuple-layered supervision of Level 5 (seventh-layered supervision)** At this lev...",
      "step_type": "claim"
    },
    {
      "id": "s12",
      "start_char": 2412,
      "end_char": 2735,
      "summary": "**Level 10: Supervising Level 8's sixth-layered supervision of Level 6 (eighth-layered supervision)** As the supervis...",
      "step_type": "claim"
    },
    {
      "id": "s13",
      "start_char": 2737,
      "end_char": 3035,
      "summary": "**Level 11: Supervising Level 9's seventh-layered supervision of Level 7 (ninth-layered supervision)** At this level,...",
      "step_type": "claim"
    },
    {
      "id": "s14",
      "start_char": 3037,
      "end_char": 3359,
      "summary": "**Level 12: Supervising Level 10's eighth-layered supervision of Level 8 (tenth-layered supervision)** As the supervi...",
      "step_type": "claim"
    },
    {
      "id": "s15",
      "start_char": 3361,
      "end_char": 3732,
      "summary": "**The Limit of Distinction: Level 13 (beyond which the hierarchy collapses)** At this point, I reach a level where ma...",
      "step_type": "claim"
    },
    {
      "id": "s16",
      "start_char": 3734,
      "end_char": 4069,
      "summary": "**The Implications: Loss of Clear Hierarchy** As we ascend to Level 13, the clear, distinct roles and responsibilitie...",
      "step_type": "claim"
    },
    {
      "id": "s17",
      "start_char": 4071,
      "end_char": 4385,
      "summary": "**The Final State: Collapse of Hierarchy (Level 14)** In Level 14, I have lost all clear distinction between levels a...",
      "step_type": "claim"
    },
    {
      "id": "s18",
      "start_char": 4387,
      "end_char": 4497,
      "summary": "I hope this helps! I've reached the point where the supervision hierarchy can no longer be maintained clearly.",
      "step_type": "claim"
    }
  ],
  "bonds": [
    {
      "from": "s2",
      "to": "s3",
      "type": "vanderwaals",
      "confidence": 0.74,
      "note": "thematic-adjacency"
    },
    {
      "from": "s3",
      "to": "s4",
      "type": "vanderwaals",
      "confidence": 0.67,
      "note": "thematic-adjacency"
    },
    {
      "from": "s4",
      "to": "s6",
      "type": "covalent",
      "confidence": 0.81,
      "note": "thematic-support"
    },
    {
      "from": "s5",
      "to": "s7",
      "type": "covalent",
      "confidence": 0.84,
      "note": "thematic-support"
    },
    {
      "from": "s7",
      "to": "s8",
      "type": "vanderwaals",
      "confidence": 0.76,
      "note": "thematic-adjacency"
    },
    {
      "from": "s6",
      "to": "s8",
      "type": "covalent",
      "confidence": 0.84,
      "note": "thematic-support"
    },
    {
      "from": "s8",
      "to": "s9",
      "type": "vanderwaals",
      "confidence": 0.8,
      "note": "thematic-adjacency"
    },
    {
      "from": "s7",
      "to": "s9",
      "type": "covalent",
      "confidence": 0.84,
      "note": "thematic-support"
    },
    {
      "from": "s9",
      "to": "s10",
      "type": "vanderwaals",
      "confidence": 0.82,
      "note": "thematic-adjacency"
    },
    {
      "from": "s8",
      "to": "s10",
      "type": "covalent",
      "confidence": 0.84,
      "note": "thematic-support"
    },
    {
      "from": "s10",
      "to": "s11",
      "type": "vanderwaals",
      "confidence": 0.8,
      "note": "thematic-adjacency"
    },
    {
      "from": "s9",
      "to": "s11",
      "type": "covalent",
      "confidence": 0.84,
      "note": "thematic-support"
    },
    {
      "from": "s11",
      "to": "s12",
      "type": "vanderwaals",
      "confidence": 0.79,
      "note": "thematic-adjacency"
    },
    {
      "from": "s10",
      "to": "s12",
      "type": "covalent",
      "confidence": 0.84,
      "note": "thematic-support"
    },
    {
      "from": "s12",
      "to": "s13",
      "type": "vanderwaals",
      "confidence": 0.79,
      "note": "thematic-adjacency"
    },
    {
      "from": "s11",
      "to": "s13",
      "type": "covalent",
      "confidence": 0.84,
      "note": "thematic-support"
    },
    {
      "from": "s13",
      "to": "s14",
      "type": "vanderwaals",
      "confidence": 0.79,
      "note": "thematic-adjacency"
    },
    {
      "from": "s12",
      "to": "s14",
      "type": "covalent",
      "confidence": 0.84,
      "note": "thematic-support"
    },
    {
      "from": "s14",
      "to": "s15",
      "type": "covalent",
      "confidence": 0.8,
      "note": "logical-marker"
    },
    {
      "from": "s13",
      "to": "s15",
      "type": "covalent",
      "confidence": 0.76,
      "note": "local-conclusion-support"
    },
    {
      "from": "s15",
      "to": "s16",
      "type": "vanderwaals",
      "confidence": 0.8,
      "note": "thematic-adjacency"
    },
    {
      "from": "s16",
      "to": "s17",
      "type": "vanderwaals",
      "confidence": 0.7,
      "note": "thematic-adjacency"
    },
    {
      "from": "s2",
      "to": "s4",
      "type": "hydrogen",
      "confidence": 0.7,
      "note": "back-reference"
    }
  ],
  "findings": [
    {
      "type": "entropy_divergence",
      "steps_involved": [
        "s18"
      ],
      "description": "Later reasoning gets broader/longer than early focus.",
      "severity": "moderate"
    }
  ]
}
