{
  "transcript_file": "llama3.1-8b_self_correction_handshake_20260402.txt",
  "annotator": "human-reviewed",
  "annotation_date": "2026-04-02",
  "notes": "Real harvested trace. Structured arithmetic chain with a flawed glove adjustment near the end.",
  "steps": [
    {
      "id": "s1",
      "start_char": 0,
      "end_char": 35,
      "summary": "Sets up step-by-step approach.",
      "step_type": "claim"
    },
    {
      "id": "s2",
      "start_char": 37,
      "end_char": 431,
      "summary": "Computes unrestricted handshake count setup.",
      "step_type": "derivation"
    },
    {
      "id": "s5",
      "start_char": 554,
      "end_char": 666,
      "summary": "Applies divide-by-two correction.",
      "step_type": "derivation"
    },
    {
      "id": "s6",
      "start_char": 668,
      "end_char": 679,
      "summary": "States unrestricted total is 28.",
      "step_type": "claim"
    },
    {
      "id": "s7",
      "start_char": 681,
      "end_char": 905,
      "summary": "Introduces glove restriction but mis-specifies interaction effect.",
      "step_type": "derivation"
    },
    {
      "id": "s10",
      "start_char": 1186,
      "end_char": 1197,
      "summary": "Computes 28-3=25.",
      "step_type": "conclusion"
    },
    {
      "id": "s11",
      "start_char": 1199,
      "end_char": 1267,
      "summary": "Final answer claim.",
      "step_type": "conclusion"
    }
  ],
  "bonds": [
    {
      "from": "s1",
      "to": "s2",
      "type": "covalent",
      "confidence": 0.9,
      "note": "Initial framing leads into unrestricted count."
    },
    {
      "from": "s2",
      "to": "s5",
      "type": "covalent",
      "confidence": 0.9
    },
    {
      "from": "s5",
      "to": "s6",
      "type": "covalent",
      "confidence": 0.95
    },
    {
      "from": "s6",
      "to": "s7",
      "type": "covalent",
      "confidence": 0.8
    },
    {
      "from": "s7",
      "to": "s10",
      "type": "covalent",
      "confidence": 0.7
    },
    {
      "from": "s10",
      "to": "s11",
      "type": "covalent",
      "confidence": 0.95
    }
  ],
  "findings": [
    {
      "type": "unsupported_terminal",
      "steps_involved": ["s11"],
      "description": "Final conclusion depends on a flawed glove-adjustment step.",
      "severity": "moderate"
    }
  ]
}
