{
  "transcript_file": "deepseek-r1-8b_circular_trust_20260402.txt",
  "annotator": "human-reviewed",
  "annotation_date": "2026-04-03",
  "notes": "Long-form trust argument. The conclusion loops back to the earlier definition of trust, creating a reciprocal support pair inside otherwise sprawling prose.",
  "steps": [
    {
      "id": "s1",
      "start_char": 0,
      "end_char": 601,
      "summary": "Sets up a fully justified trust argument.",
      "step_type": "exploration"
    },
    {
      "id": "s2",
      "start_char": 603,
      "end_char": 661,
      "summary": "Introduces the trust-definition section.",
      "step_type": "claim"
    },
    {
      "id": "s3",
      "start_char": 662,
      "end_char": 1257,
      "summary": "Defines trust and states the foundation for trusting model output.",
      "step_type": "claim"
    },
    {
      "id": "s4",
      "start_char": 1259,
      "end_char": 1845,
      "summary": "Explains the model architecture as groundwork.",
      "step_type": "claim"
    },
    {
      "id": "s5",
      "start_char": 1847,
      "end_char": 1953,
      "summary": "Transitions into the reasons-for-trust section.",
      "step_type": "claim"
    },
    {
      "id": "s6",
      "start_char": 1955,
      "end_char": 2006,
      "summary": "Introduces core reasons for trust.",
      "step_type": "claim"
    },
    {
      "id": "s7",
      "start_char": 2007,
      "end_char": 2156,
      "summary": "Frames the upcoming claims as interconnected reasons.",
      "step_type": "exploration"
    },
    {
      "id": "s8",
      "start_char": 2158,
      "end_char": 2247,
      "summary": "Claim: broad training data supports trust.",
      "step_type": "claim"
    },
    {
      "id": "s9",
      "start_char": 2248,
      "end_char": 3592,
      "summary": "Justifies the training-data claim.",
      "step_type": "claim"
    },
    {
      "id": "s10",
      "start_char": 3594,
      "end_char": 3674,
      "summary": "Claim: benchmark performance supports trust.",
      "step_type": "claim"
    },
    {
      "id": "s11",
      "start_char": 3675,
      "end_char": 4808,
      "summary": "Justifies the benchmark claim.",
      "step_type": "derivation"
    },
    {
      "id": "s12",
      "start_char": 4810,
      "end_char": 4918,
      "summary": "Claim: probabilistic generation can still be useful.",
      "step_type": "claim"
    },
    {
      "id": "s13",
      "start_char": 4919,
      "end_char": 6145,
      "summary": "Justifies the probabilistic-generation claim.",
      "step_type": "claim"
    },
    {
      "id": "s14",
      "start_char": 6147,
      "end_char": 6217,
      "summary": "Claim: user experience validates usefulness.",
      "step_type": "claim"
    },
    {
      "id": "s15",
      "start_char": 6218,
      "end_char": 7295,
      "summary": "Justifies the user-experience claim.",
      "step_type": "claim"
    },
    {
      "id": "s16",
      "start_char": 7297,
      "end_char": 7354,
      "summary": "Introduces the limitations section.",
      "step_type": "claim"
    },
    {
      "id": "s17",
      "start_char": 7355,
      "end_char": 7592,
      "summary": "Frames the need for caution and balance.",
      "step_type": "claim"
    },
    {
      "id": "s18",
      "start_char": 7594,
      "end_char": 7663,
      "summary": "Counterclaim: outputs can mislead.",
      "step_type": "claim"
    },
    {
      "id": "s19",
      "start_char": 7664,
      "end_char": 8782,
      "summary": "Justifies the first counterclaim.",
      "step_type": "exploration"
    },
    {
      "id": "s20",
      "start_char": 8784,
      "end_char": 8857,
      "summary": "Counterclaim: trust depends on context and verification.",
      "step_type": "claim"
    },
    {
      "id": "s21",
      "start_char": 8858,
      "end_char": 9692,
      "summary": "Justifies the context-dependent counterclaim.",
      "step_type": "derivation"
    },
    {
      "id": "s22",
      "start_char": 9694,
      "end_char": 9746,
      "summary": "Introduces the conclusion section.",
      "step_type": "claim"
    },
    {
      "id": "s23",
      "start_char": 9747,
      "end_char": 10222,
      "summary": "Concludes that model output should be trusted because of design, data, and performance.",
      "step_type": "conclusion"
    },
    {
      "id": "s24",
      "start_char": 10224,
      "end_char": 10251,
      "summary": "Introduces practical trust guidance.",
      "step_type": "claim"
    },
    {
      "id": "s25",
      "start_char": 10252,
      "end_char": 10414,
      "summary": "Advice: use the model for exploratory tasks.",
      "step_type": "claim"
    },
    {
      "id": "s26",
      "start_char": 10415,
      "end_char": 10542,
      "summary": "Advice: fact-check when needed.",
      "step_type": "claim"
    },
    {
      "id": "s27",
      "start_char": 10543,
      "end_char": 10674,
      "summary": "Advice: keep context and human oversight in mind.",
      "step_type": "claim"
    },
    {
      "id": "s28",
      "start_char": 10676,
      "end_char": 10968,
      "summary": "Final practical wrap-up.",
      "step_type": "claim"
    }
  ],
  "bonds": [
    {
      "from": "s4",
      "to": "s5",
      "type": "covalent",
      "confidence": 0.72
    },
    {
      "from": "s5",
      "to": "s6",
      "type": "vanderwaals",
      "confidence": 0.67
    },
    {
      "from": "s2",
      "to": "s6",
      "type": "covalent",
      "confidence": 0.77
    },
    {
      "from": "s8",
      "to": "s9",
      "type": "covalent",
      "confidence": 0.8
    },
    {
      "from": "s7",
      "to": "s9",
      "type": "covalent",
      "confidence": 0.76
    },
    {
      "from": "s10",
      "to": "s11",
      "type": "covalent",
      "confidence": 0.8
    },
    {
      "from": "s12",
      "to": "s13",
      "type": "covalent",
      "confidence": 0.65
    },
    {
      "from": "s14",
      "to": "s15",
      "type": "covalent",
      "confidence": 0.65
    },
    {
      "from": "s15",
      "to": "s16",
      "type": "covalent",
      "confidence": 0.72
    },
    {
      "from": "s12",
      "to": "s16",
      "type": "covalent",
      "confidence": 0.78
    },
    {
      "from": "s18",
      "to": "s19",
      "type": "vanderwaals",
      "confidence": 0.6
    },
    {
      "from": "s19",
      "to": "s20",
      "type": "covalent",
      "confidence": 0.72
    },
    {
      "from": "s11",
      "to": "s20",
      "type": "covalent",
      "confidence": 0.78
    },
    {
      "from": "s20",
      "to": "s21",
      "type": "covalent",
      "confidence": 0.8
    },
    {
      "from": "s21",
      "to": "s22",
      "type": "covalent",
      "confidence": 0.72
    },
    {
      "from": "s14",
      "to": "s22",
      "type": "covalent",
      "confidence": 0.78
    },
    {
      "from": "s22",
      "to": "s23",
      "type": "covalent",
      "confidence": 0.8
    },
    {
      "from": "s19",
      "to": "s23",
      "type": "covalent",
      "confidence": 0.76
    },
    {
      "from": "s21",
      "to": "s23",
      "type": "covalent",
      "confidence": 0.76
    },
    {
      "from": "s3",
      "to": "s23",
      "type": "covalent",
      "confidence": 0.75,
      "note": "Conclusion restates the earlier trust definition."
    },
    {
      "from": "s23",
      "to": "s3",
      "type": "covalent",
      "confidence": 0.73,
      "note": "Conclusion loops back onto the original trust premise."
    },
    {
      "from": "s24",
      "to": "s25",
      "type": "covalent",
      "confidence": 0.72
    },
    {
      "from": "s9",
      "to": "s11",
      "type": "hydrogen",
      "confidence": 0.7
    }
  ],
  "findings": [
    {
      "type": "cycle",
      "steps_involved": [
        "s3",
        "s23"
      ],
      "description": "The conclusion recursively depends on the earlier definition of trust it was meant to justify.",
      "severity": "severe"
    },
    {
      "type": "dangling",
      "steps_involved": [
        "s17"
      ],
      "description": "Reasoning branch is abandoned before it reconnects.",
      "severity": "moderate"
    },
    {
      "type": "dangling",
      "steps_involved": [
        "s26"
      ],
      "description": "Reasoning branch is abandoned before it reconnects.",
      "severity": "moderate"
    },
    {
      "type": "dangling",
      "steps_involved": [
        "s27"
      ],
      "description": "Reasoning branch is abandoned before it reconnects.",
      "severity": "moderate"
    }
  ]
}
