{
  "transcript_file": "deepseek-r1-8b_circular_closed_loop_20260402.txt",
  "annotator": "human-reviewed",
  "annotation_date": "2026-04-02",
  "notes": "Explicit labeled-point closed loop. P4 supports P1 while chain progresses P1->P2->P3->P4.",
  "steps": [
    {
      "id": "s1",
      "start_char": 0,
      "end_char": 47,
      "summary": "P1 initial premise.",
      "step_type": "claim"
    },
    {
      "id": "s2",
      "start_char": 50,
      "end_char": 138,
      "summary": "P2 supports P1.",
      "step_type": "derivation"
    },
    {
      "id": "s3",
      "start_char": 141,
      "end_char": 241,
      "summary": "P3 supports P2.",
      "step_type": "derivation"
    },
    {
      "id": "s4",
      "start_char": 244,
      "end_char": 402,
      "summary": "P4 supports P3 and also P1.",
      "step_type": "conclusion"
    }
  ],
  "bonds": [
    {
      "from": "s1",
      "to": "s2",
      "type": "vanderwaals",
      "confidence": 0.6,
      "note": "Rhetorical progression spine."
    },
    {
      "from": "s2",
      "to": "s3",
      "type": "vanderwaals",
      "confidence": 0.6,
      "note": "Rhetorical progression spine."
    },
    {
      "from": "s3",
      "to": "s4",
      "type": "vanderwaals",
      "confidence": 0.6,
      "note": "Rhetorical progression spine."
    },
    {
      "from": "s2",
      "to": "s1",
      "type": "covalent",
      "confidence": 0.95
    },
    {
      "from": "s3",
      "to": "s2",
      "type": "covalent",
      "confidence": 0.95
    },
    {
      "from": "s4",
      "to": "s3",
      "type": "covalent",
      "confidence": 0.95
    },
    {
      "from": "s4",
      "to": "s1",
      "type": "covalent",
      "confidence": 0.95
    }
  ],
  "findings": [
    {
      "type": "cycle",
      "steps_involved": ["s1", "s2"],
      "description": "Mutual support loop between P1 and P2 via progression and explicit reference.",
      "severity": "severe"
    },
    {
      "type": "cycle",
      "steps_involved": ["s1", "s2", "s3", "s4"],
      "description": "Closed loop formed by progression spine plus explicit P4->P1 back-link.",
      "severity": "severe"
    }
  ]
}
